{
  "schema": 1,
  "date": "2026-07-12",
  "environment": {
    "gpu": {
      "name": "NVIDIA GeForce RTX 3060",
      "sm": "8.6",
      "vram_mib": 12288,
      "driver": "580.95.05"
    },
    "gpu_count": 1,
    "cuda": "12.9",
    "cpu": {
      "model": "AMD Ryzen 7 7700X 8-Core Processor",
      "cores": 8,
      "max_mhz": 5572
    },
    "platform": "bare-metal",
    "os": "Ubuntu 20.04.6 LTS",
    "ram_gib": 46
  },
  "code": {
    "commit": "d811ad61ad5e",
    "dirty": true
  },
  "results": {
    "concurrency.memcpy-kernel.htod": {
      "unit": "ms",
      "series": {
        "0": 5.02,
        "64": 5.01,
        "128": 5.03,
        "192": 5.02,
        "256": 5.01,
        "320": 5.01,
        "384": 5.01,
        "448": 5.01,
        "512": 5,
        "576": 5,
        "640": 5.01,
        "704": 5.03,
        "768": 5.01,
        "832": 5.01,
        "896": 5.01,
        "960": 5.01,
        "1024": 5.01,
        "1088": 5.01,
        "1152": 5.01,
        "1216": 5.01,
        "1280": 5.01,
        "1344": 5.01,
        "1408": 5.01,
        "1472": 5.01,
        "1536": 5.01,
        "1600": 5.01,
        "1664": 5.01,
        "1728": 5.01,
        "1792": 5.01,
        "1856": 5.01,
        "1920": 5.01,
        "1984": 5.01,
        "2048": 5.01,
        "2112": 5.01,
        "2176": 5.01,
        "2240": 5.01,
        "2304": 5.01,
        "2368": 5.01,
        "2432": 5.01,
        "2496": 5.01,
        "2560": 5.01,
        "2624": 5.01,
        "2688": 5.01,
        "2752": 5.01,
        "2816": 5.01,
        "2880": 5.01,
        "2944": 5.01,
        "3008": 5.01,
        "3072": 5.01,
        "3136": 5.01,
        "3200": 5.01,
        "3264": 5.01,
        "3328": 5.01,
        "3392": 5.01,
        "3456": 5.01,
        "3520": 5.02,
        "3584": 5.01,
        "3648": 5.01,
        "3712": 5.01,
        "3776": 5.01,
        "3840": 5.01,
        "3904": 5.02,
        "3968": 5.01,
        "4032": 5.01,
        "4096": 5.01
      }
    },
    "concurrency.memcpy-kernel.kernel": {
      "unit": "ms",
      "series": {
        "0": 0.88,
        "64": 0.87,
        "128": 1.04,
        "192": 1.44,
        "256": 1.86,
        "320": 2.27,
        "384": 2.69,
        "448": 3.1,
        "512": 3.51,
        "576": 3.93,
        "640": 4.34,
        "704": 4.75,
        "768": 5.15,
        "832": 5.56,
        "896": 5.98,
        "960": 6.39,
        "1024": 6.8,
        "1088": 7.21,
        "1152": 7.63,
        "1216": 7.63,
        "1280": 8.03,
        "1344": 8.42,
        "1408": 8.81,
        "1472": 9.2,
        "1536": 9.59,
        "1600": 9.98,
        "1664": 10.37,
        "1728": 10.76,
        "1792": 11.15,
        "1856": 11.26,
        "1920": 11.57,
        "1984": 11.94,
        "2048": 12.32,
        "2112": 12.7,
        "2176": 13.08,
        "2240": 13.46,
        "2304": 13.84,
        "2368": 14.22,
        "2432": 14.59,
        "2496": 14.97,
        "2560": 15.35,
        "2624": 15.73,
        "2688": 16.11,
        "2752": 16.49,
        "2816": 16.87,
        "2880": 17.25,
        "2944": 17.62,
        "3008": 18,
        "3072": 18.38,
        "3136": 18.76,
        "3200": 19.14,
        "3264": 19.52,
        "3328": 19.9,
        "3392": 20.28,
        "3456": 20.65,
        "3520": 21.03,
        "3584": 21.42,
        "3648": 21.8,
        "3712": 22.17,
        "3776": 22.55,
        "3840": 22.92,
        "3904": 23.3,
        "3968": 23.68,
        "4032": 24.06,
        "4096": 24.44
      }
    },
    "concurrency.memcpy-kernel.dtoh": {
      "unit": "ms",
      "series": {
        "0": 5.1,
        "64": 5.1,
        "128": 5.1,
        "192": 5.1,
        "256": 5.1,
        "320": 5.1,
        "384": 5.1,
        "448": 5.1,
        "512": 5.1,
        "576": 5.1,
        "640": 5.1,
        "704": 5.1,
        "768": 5.1,
        "832": 5.1,
        "896": 5.1,
        "960": 5.1,
        "1024": 5.1,
        "1088": 5.1,
        "1152": 5.1,
        "1216": 5.1,
        "1280": 5.1,
        "1344": 5.1,
        "1408": 5.1,
        "1472": 5.1,
        "1536": 5.1,
        "1600": 5.1,
        "1664": 5.1,
        "1728": 5.11,
        "1792": 5.1,
        "1856": 5.1,
        "1920": 5.1,
        "1984": 5.1,
        "2048": 5.1,
        "2112": 5.1,
        "2176": 5.1,
        "2240": 5.1,
        "2304": 5.11,
        "2368": 5.1,
        "2432": 5.1,
        "2496": 5.1,
        "2560": 5.11,
        "2624": 5.1,
        "2688": 5.1,
        "2752": 5.1,
        "2816": 5.1,
        "2880": 5.1,
        "2944": 5.1,
        "3008": 5.1,
        "3072": 5.1,
        "3136": 5.1,
        "3200": 5.1,
        "3264": 5.1,
        "3328": 5.1,
        "3392": 5.1,
        "3456": 5.11,
        "3520": 5.1,
        "3584": 5.1,
        "3648": 5.1,
        "3712": 5.1,
        "3776": 5.1,
        "3840": 5.1,
        "3904": 5.1,
        "3968": 5.1,
        "4032": 5.1,
        "4096": 5.1
      }
    },
    "concurrency.memcpy-kernel.total": {
      "unit": "ms",
      "series": {
        "0": 11,
        "64": 10.98,
        "128": 11.17,
        "192": 11.56,
        "256": 11.96,
        "320": 12.37,
        "384": 12.79,
        "448": 13.21,
        "512": 13.62,
        "576": 14.03,
        "640": 14.44,
        "704": 14.88,
        "768": 15.26,
        "832": 15.67,
        "896": 16.08,
        "960": 16.49,
        "1024": 16.91,
        "1088": 17.32,
        "1152": 17.73,
        "1216": 17.74,
        "1280": 18.14,
        "1344": 18.53,
        "1408": 18.92,
        "1472": 19.3,
        "1536": 19.69,
        "1600": 20.09,
        "1664": 20.47,
        "1728": 20.88,
        "1792": 21.27,
        "1856": 21.36,
        "1920": 21.67,
        "1984": 22.06,
        "2048": 22.43,
        "2112": 22.81,
        "2176": 23.18,
        "2240": 23.56,
        "2304": 23.95,
        "2368": 24.32,
        "2432": 24.71,
        "2496": 25.09,
        "2560": 25.47,
        "2624": 25.84,
        "2688": 26.23,
        "2752": 26.6,
        "2816": 26.97,
        "2880": 27.35,
        "2944": 27.73,
        "3008": 28.11,
        "3072": 28.48,
        "3136": 28.86,
        "3200": 29.25,
        "3264": 29.63,
        "3328": 30,
        "3392": 30.39,
        "3456": 30.76,
        "3520": 31.15,
        "3584": 31.52,
        "3648": 31.91,
        "3712": 32.27,
        "3776": 32.66,
        "3840": 33.03,
        "3904": 33.41,
        "3968": 33.79,
        "4032": 34.17,
        "4096": 34.54
      }
    },
    "concurrency.memcpy-kernel.concurrent": {
      "unit": "ms",
      "series": {
        "0": 6.91,
        "64": 6.87,
        "128": 6.88,
        "192": 6.88,
        "256": 6.91,
        "320": 6.88,
        "384": 6.95,
        "448": 7.04,
        "512": 7.09,
        "576": 7.17,
        "640": 7.23,
        "704": 7.28,
        "768": 7.38,
        "832": 7.45,
        "896": 7.45,
        "960": 7.57,
        "1024": 7.98,
        "1088": 8.4,
        "1152": 8.81,
        "1216": 9.21,
        "1280": 9.62,
        "1344": 10.03,
        "1408": 10.43,
        "1472": 10.84,
        "1536": 11.25,
        "1600": 11.66,
        "1664": 12.06,
        "1728": 12.47,
        "1792": 12.88,
        "1856": 13.3,
        "1920": 13.7,
        "1984": 14.11,
        "2048": 14.52,
        "2112": 14.93,
        "2176": 15.34,
        "2240": 15.74,
        "2304": 16.15,
        "2368": 16.56,
        "2432": 16.97,
        "2496": 17.38,
        "2560": 17.78,
        "2624": 18.19,
        "2688": 18.6,
        "2752": 19.01,
        "2816": 19.42,
        "2880": 19.82,
        "2944": 20.24,
        "3008": 20.64,
        "3072": 21.06,
        "3136": 21.46,
        "3200": 21.86,
        "3264": 22.28,
        "3328": 22.69,
        "3392": 23.09,
        "3456": 23.5,
        "3520": 23.9,
        "3584": 24.31,
        "3648": 24.72,
        "3712": 25.14,
        "3776": 25.54,
        "3840": 25.95,
        "3904": 26.36,
        "3968": 26.77,
        "4032": 27.17,
        "4096": 27.58
      }
    },
    "concurrency.memcpy-kernel.speedup": {
      "unit": "x",
      "series": {
        "0": 1.59,
        "64": 1.6,
        "128": 1.62,
        "192": 1.68,
        "256": 1.73,
        "320": 1.8,
        "384": 1.84,
        "448": 1.88,
        "512": 1.92,
        "576": 1.96,
        "640": 2,
        "704": 2.04,
        "768": 2.07,
        "832": 2.1,
        "896": 2.16,
        "960": 2.18,
        "1024": 2.12,
        "1088": 2.06,
        "1152": 2.01,
        "1216": 1.93,
        "1280": 1.88,
        "1344": 1.85,
        "1408": 1.81,
        "1472": 1.78,
        "1536": 1.75,
        "1600": 1.72,
        "1664": 1.7,
        "1728": 1.67,
        "1792": 1.65,
        "1856": 1.61,
        "1920": 1.58,
        "1984": 1.56,
        "2048": 1.55,
        "2112": 1.53,
        "2176": 1.51,
        "2240": 1.5,
        "2304": 1.48,
        "2368": 1.47,
        "2432": 1.46,
        "2496": 1.44,
        "2560": 1.43,
        "2624": 1.42,
        "2688": 1.41,
        "2752": 1.4,
        "2816": 1.39,
        "2880": 1.38,
        "2944": 1.37,
        "3008": 1.36,
        "3072": 1.35,
        "3136": 1.34,
        "3200": 1.34,
        "3264": 1.33,
        "3328": 1.32,
        "3392": 1.32,
        "3456": 1.31,
        "3520": 1.3,
        "3584": 1.3,
        "3648": 1.29,
        "3712": 1.28,
        "3776": 1.28,
        "3840": 1.27,
        "3904": 1.27,
        "3968": 1.26,
        "4032": 1.26,
        "4096": 1.25
      }
    },
    "global.read.peak": {
      "unit": "GB/s",
      "series": {
        "1": 300.48,
        "2": 311.03,
        "4": 315.58,
        "8": 317.48,
        "16": 318.5
      }
    },
    "global.write.peak": {
      "unit": "GB/s",
      "series": {
        "1": 304.66,
        "2": 311.19,
        "4": 306.56,
        "8": 308.26,
        "16": 304.23
      }
    },
    "global.copy.peak": {